{
  "formatVersion": "1.1",
  "id": "customer-activity-context",
  "version": "2026-07-31.1",
  "generatedAt": "2026-07-31T08:00:00.000Z",
  "source": "customer-activity-dqe",
  "executionEnvironments": [
    {
      "id": "dqe-customer-activity",
      "name": "客户活动 DQE",
      "language": "dqe",
      "endpointRef": "dqe-primary",
      "description": "面向客户活动风险分析的受控 DQE 执行环境",
      "schemas": [
        {
          "id": "customer-activity",
          "name": "客户活动",
          "description": "客户分层、活动次数与活动完成情况",
          "metrics": [
            {
              "name": "NA客户数",
              "type": "number",
              "description": "符合当前查询条件的 NA 客户数量",
              "aliases": [
                "客户数"
              ],
              "unit": "个",
              "additivity": "半可加",
              "timeAggregation": "期末值",
              "isRatio": false,
              "dimensions": [
                "客户级别",
                "地区部",
                "统计月份"
              ],
              "nullable": false,
              "sensitive": false
            }
          ],
          "objects": [
            {
              "id": "customer-activity-summary",
              "name": "客户活动汇总",
              "kind": "dataset",
              "description": "按客户级别、地区部和统计周期查询客户活动汇总",
              "fields": [
                {
                  "name": "客户级别",
                  "type": "string",
                  "description": "客户经营分层",
                  "aliases": [
                    "客户层级",
                    "NA级别"
                  ],
                  "roleHints": [
                    "dimension"
                  ],
                  "nullable": false,
                  "sensitive": false
                },
                {
                  "name": "地区部",
                  "type": "string",
                  "description": "客户归属地区部",
                  "aliases": [
                    "区域"
                  ],
                  "roleHints": [
                    "dimension"
                  ],
                  "nullable": false,
                  "sensitive": false
                },
                {
                  "name": "统计月份",
                  "type": "date",
                  "description": "月粒度统计时间",
                  "aliases": [
                    "月份"
                  ],
                  "roleHints": [
                    "dimension",
                    "time"
                  ],
                  "granularity": "month",
                  "nullable": false,
                  "sensitive": false
                }
              ]
            }
          ],
          "relationships": [],
          "verifiedQueries": [
            {
              "id": "customer-count-by-level",
              "question": "按客户级别查看 NA 客户数",
              "description": "返回客户级别和对应 NA 客户数量",
              "language": "dqe",
              "body": {
                "dsl_list": [
                  {
                    "output_dims": [
                      "客户级别"
                    ],
                    "output_metrics": [
                      "NA客户数"
                    ],
                    "filter": {
                      "dims": [],
                      "metrics": []
                    },
                    "order": {}
                  }
                ]
              },
              "resultFields": [
                {
                  "name": "客户级别",
                  "type": "string",
                  "role": "dimension",
                  "nullable": false
                },
                {
                  "name": "NA客户数",
                  "type": "number",
                  "role": "measure",
                  "unit": "个",
                  "nullable": false
                }
              ]
            }
          ]
        },
        {
          "id": "operations-analytics",
          "name": "运营分析",
          "description": "Tokens 服务的用量、计费与调用运营分析",
          "metrics": [
            {
              "name": "Tokens消耗量",
              "type": "number",
              "description": "统计期内推理与训练消耗的 Token 总量",
              "aliases": [
                "消耗量",
                "用量"
              ],
              "unit": "Token",
              "additivity": "可加",
              "timeAggregation": "求和",
              "isRatio": false,
              "dimensions": [
                "区域",
                "模型",
                "统计周期"
              ],
              "nullable": false,
              "sensitive": false
            },
            {
              "name": "计费Tokens量",
              "type": "number",
              "description": "统计期内计费的 Token 量,排除内部试用额度",
              "aliases": [
                "计费量"
              ],
              "unit": "Token",
              "additivity": "可加",
              "timeAggregation": "求和",
              "isRatio": false,
              "dimensions": [
                "区域",
                "模型",
                "统计周期"
              ],
              "nullable": false,
              "sensitive": false
            },
            {
              "name": "Tokens请求量",
              "type": "number",
              "description": "统计期内的模型调用请求次数,按请求计数而非 Token 计数",
              "aliases": [
                "调用次数"
              ],
              "unit": "次",
              "additivity": "可加",
              "timeAggregation": "求和",
              "isRatio": false,
              "dimensions": [
                "区域",
                "模型",
                "统计周期"
              ],
              "nullable": false,
              "sensitive": false
            },
            {
              "name": "失败请求量",
              "type": "number",
              "description": "统计期内失败的模型调用请求次数",
              "unit": "次",
              "additivity": "可加",
              "timeAggregation": "求和",
              "isRatio": false,
              "dimensions": [
                "区域",
                "模型",
                "统计周期"
              ],
              "nullable": false,
              "sensitive": false
            },
            {
              "name": "客户数",
              "type": "number",
              "description": "统计期内发起过模型调用的去重客户数,与客户经营域的期末在册口径不同",
              "aliases": [
                "在用客户数",
                "活跃客户数"
              ],
              "unit": "家",
              "additivity": "不可加",
              "timeAggregation": "均值",
              "isRatio": false,
              "dimensions": [
                "区域",
                "模型",
                "统计周期"
              ],
              "nullable": false,
              "sensitive": false
            }
          ],
          "objects": [
            {
              "id": "operations-analytics-surface",
              "name": "运营分析语义面",
              "kind": "dataset",
              "description": "业务域「运营分析」组合式语义面的可组合指标与维度",
              "fields": [
                {
                  "name": "区域",
                  "type": "string",
                  "description": "业务归属区域。取值域:华东、华南、华北、西南、华中、东北、西北。",
                  "aliases": [
                    "大区"
                  ],
                  "roleHints": [
                    "dimension"
                  ],
                  "nullable": false,
                  "sensitive": false
                },
                {
                  "name": "模型",
                  "type": "string",
                  "description": "提供服务的模型系列。取值域:通用大模型、代码大模型、多模态大模型。",
                  "aliases": [
                    "模型系列"
                  ],
                  "roleHints": [
                    "dimension"
                  ],
                  "nullable": false,
                  "sensitive": false
                },
                {
                  "name": "统计周期",
                  "type": "date",
                  "description": "按查询时间粒度展开的统计周期。支持的时间粒度:month、day。",
                  "aliases": [
                    "统计时间"
                  ],
                  "roleHints": [
                    "dimension",
                    "time"
                  ],
                  "granularity": "month,day",
                  "nullable": false,
                  "sensitive": false
                }
              ]
            }
          ],
          "relationships": [],
          "verifiedQueries": [
            {
              "id": "tokens-consumption-by-region",
              "question": "各区域一季度的 Tokens 消耗量是多少",
              "description": "按区域返回 2026 年一季度的 Tokens 消耗量合计",
              "language": "dqe",
              "body": {
                "dsl_list": [
                  {
                    "output_dims": [
                      "区域"
                    ],
                    "output_metrics": [
                      "Tokens消耗量"
                    ],
                    "filter": {
                      "time": {
                        "period": "month",
                        "start": "2026-01",
                        "end": "2026-03"
                      },
                      "dims": [],
                      "metrics": []
                    },
                    "order": {}
                  }
                ]
              },
              "resultFields": [
                {
                  "name": "区域",
                  "type": "string",
                  "role": "dimension",
                  "nullable": false
                },
                {
                  "name": "Tokens消耗量",
                  "type": "number",
                  "role": "measure",
                  "unit": "Token",
                  "nullable": false
                }
              ]
            }
          ]
        },
        {
          "id": "customer-management",
          "name": "客户经营",
          "description": "客户规模、增长与流失的经营分析",
          "metrics": [
            {
              "name": "客户数",
              "type": "number",
              "description": "期末在册客户总数,与运营分析域的在用调用口径不同",
              "aliases": [
                "在册客户数",
                "存量客户数"
              ],